{
  "schemaVersion": "1.0",
  "artifactType": "understanding-guide",
  "metadata": {
    "title": "First-run Welcome Experience",
    "topic": "First-run Welcome",
    "project": "Travel App",
    "sourceRef": "c847650e6ea2fc58d6bee7b60f72a290e4fc3b21",
    "generatedAt": "2026-07-22T12:00:00+08:00",
    "language": "zh-TW",
    "generatorRole": "docs"
  },
  "overview": {
    "oneSentence": "First-run Welcome 是只在缺乏既有使用訊號時顯示的四步驟導覽，完成後只記錄本機 onboarding marker，再依使用者選擇開啟 Demo、空白建立流程或 Lobby。",
    "purpose": "讓真正的新使用者先理解行程、東京唯讀範例、建立旅程與離線預覽，同時避免自動建立 Firebase 資料或與 What's New、FeatureTour 疊加。",
    "audience": ["第一次使用 Travel App 的使用者", "維護 App 初始流程的工程師與 QA"],
    "prerequisites": ["理解 Lobby、Demo Preview 與真實 Trip 是互斥 App views", "知道 localStorage 是裝置狀態而非授權"]
  },
  "userJourney": [
    { "step": 1, "title": "判定是否為真正新使用者", "description": "App 在寫入空的 myTrips 預設值前建立一次 eligibility snapshot；任一既有使用訊號都會阻止自動 Welcome。" },
    { "step": 2, "title": "顯示四步驟 Welcome", "description": "符合資格且沒有 room deep link 或其他互斥 view 時顯示 dialog，What's New 與 FeatureTour 不同時顯示。" },
    { "step": 3, "title": "閱讀產品概念", "description": "四步依序介紹集中管理、東京唯讀範例、建立自己的旅程、多人協作與唯讀離線預覽。" },
    { "step": 4, "title": "選擇完成動作", "description": "使用者可開啟東京 Demo、開啟既有空白建立 Modal，或略過並留在 Lobby；三者都先完成 onboarding。" },
    { "step": 5, "title": "後續 session 行為", "description": "當次 first-run session 不立刻顯示 What's New；重新載入後 Welcome 不再顯示，未讀的 release flow 可恢復。" }
  ],
  "modules": [
    {
      "name": "onboardingState",
      "responsibility": "讀取裝置使用訊號、產生一次性 eligibility snapshot、判斷資格並安全讀寫 onboarding marker。",
      "entryPoints": ["readFirstRunEligibilitySnapshot", "shouldShowFirstRunOnboarding", "markFirstRunOnboardingSeen"],
      "dependencies": ["Browser localStorage", "window.location.search"]
    },
    {
      "name": "TravelApp coordination",
      "responsibility": "保存 first-run session gate、安排 Welcome 與其他 views/modal 的優先順序，並執行三種完成動作。",
      "entryPoints": ["TravelApp", "completeFirstRunOnboarding", "openBuiltInDemo", "openCreateModal"],
      "dependencies": ["onboardingState", "releaseNotes", "DemoTripPreview", "FirstRunWelcomeDialog"]
    },
    {
      "name": "FirstRunWelcomeDialog",
      "responsibility": "呈現四步內容、焦點控制、捲動鎖定與一次性 callback；不自行持久化或導航。",
      "entryPoints": ["FirstRunWelcomeDialog"],
      "dependencies": ["React state and effects", "App-provided callbacks"]
    },
    {
      "name": "Release experience",
      "responsibility": "管理 current release 的 seen/pending keys；first-run session 只抑制顯示，不把 release 標記為已讀。",
      "entryPoints": ["hasSeenCurrentRelease", "markCurrentReleaseSeen", "CURRENT_RELEASE_SEEN_KEY"],
      "dependencies": ["Browser localStorage", "Browser sessionStorage"]
    }
  ],
  "flows": [
    {
      "title": "Eligibility 與 deep-link 延後",
      "description": "deep link 是當次 view gate，不是 returning-user 訊號。",
      "steps": [
        { "order": 1, "action": "讀取一次性 snapshot", "result": "保留 onboarding、trips、release、外觀、offline、member identity 與 room query 狀態。" },
        { "order": 2, "action": "計算 eligibility", "result": "只有前六個既有使用訊號全為 false 才符合 first-run。" },
        { "order": 3, "action": "檢查 room deep link", "result": "有 room 時先載入 TripDetail，不寫 marker。" },
        { "order": 4, "action": "返回 Lobby", "result": "資格仍未 resolved，其他互斥 view 清除後才顯示 Welcome。" }
      ]
    },
    {
      "title": "完成 onboarding",
      "description": "App 與 Dialog 都有一次性 guard，避免雙擊或重複事件執行兩次。",
      "steps": [
        { "order": 1, "action": "接受 Demo、Create 或 Skip", "result": "completion ref 先鎖定。" },
        { "order": 2, "action": "寫入 onboarding marker", "result": "嘗試把 travel-app-seen-onboarding-v1 寫成 true；失敗不阻斷當次流程。" },
        { "order": 3, "action": "更新 App state", "result": "firstRunResolved 變 true，Welcome 卸載。" },
        { "order": 4, "action": "執行選定下一步", "result": "Demo 開本機 preview；Create 開空白 Modal；Skip 不做額外導航。" }
      ]
    }
  ],
  "state": [
    {
      "stateName": "firstRunSnapshot",
      "owner": "TravelApp",
      "initialValue": "App 首次 render 時由 readFirstRunEligibilitySnapshot 產生，之後不重新讀取。",
      "transitions": [
        { "trigger": "App mount", "from": "未建立", "to": "固定 snapshot", "effect": "避免 App 自己寫入空 myTrips 後改變資格。" }
      ]
    },
    {
      "stateName": "firstRunResolved",
      "owner": "TravelApp",
      "initialValue": "非 first-run session 為 true；first-run session 為 false。",
      "transitions": [
        { "trigger": "任一完成動作", "from": "false", "to": "true", "effect": "本 session 不重新開啟 Welcome，即使 storage write 失敗。" }
      ]
    },
    {
      "stateName": "showFirstRunWelcome",
      "owner": "TravelApp",
      "initialValue": "符合 first-run 且沒有 room deep link 時為 true。",
      "transitions": [
        { "trigger": "延後條件解除", "from": "false", "to": "true", "effect": "返回 Lobby 後顯示 Welcome 並關閉 What's New。" },
        { "trigger": "完成 onboarding", "from": "true", "to": "false", "effect": "先卸載 dialog，再進入下一個 view 或 modal。" }
      ]
    },
    {
      "stateName": "Dialog step",
      "owner": "FirstRunWelcomeDialog",
      "initialValue": "0；不合法 initialStep 也回到 0。",
      "transitions": [
        { "trigger": "Next", "from": "0-2", "to": "1-3", "effect": "只切換本機 ephemeral step，不完成 onboarding。" },
        { "trigger": "Back", "from": "1-3", "to": "0-2", "effect": "只回上一頁。" }
      ]
    }
  ],
  "data": [
    { "source": "localStorage existing-use keys", "destination": "firstRunSnapshot", "operation": "read", "persistence": "既有裝置資料，不由 Welcome 建立", "sideEffect": "無；讀取失敗時使用安全 fresh fallback。" },
    { "source": "window.location.search room", "destination": "firstRunSnapshot.hasRoomDeepLink", "operation": "read", "persistence": "URL view state", "sideEffect": "只延後顯示，不改 eligibility。" },
    { "source": "completion action", "destination": "travel-app-seen-onboarding-v1", "operation": "write true", "persistence": "localStorage", "sideEffect": "下次載入不再顯示 Welcome。" },
    { "source": "Demo action", "destination": "demoPreviewState", "operation": "create built-in view model", "persistence": "React memory only", "sideEffect": "切換到唯讀 Demo；不建立 room。" },
    { "source": "Create action", "destination": "tripModalMode", "operation": "set create", "persistence": "React memory only until user submits", "sideEffect": "顯示既有空白建立 Modal；點 CTA 本身不寫 Firebase。" }
  ],
  "boundaries": {
    "reads": [
      "travel-app-seen-onboarding-v1",
      "google-travel-my-trips",
      "travel-app-seen-release-*",
      "google-travel-custom-bg",
      "google-travel-offline-trip-cache-v1",
      "travel-active-member-* and travel-checklist-actor-*",
      "URL room query"
    ],
    "writes": ["travel-app-seen-onboarding-v1 = true after Demo, Create, Skip, or Escape"],
    "mustNotWrite": ["Firebase Realtime Database rooms", "Firebase Storage", "google-travel-my-trips Demo entries", "Offline Trip Cache", "current release seen marker", "production data or rules"],
    "externalSystems": ["Browser localStorage", "Browser sessionStorage for release flow", "Browser URL query"]
  },
  "invariants": [
    "空的 google-travel-my-trips 陣列本身不代表 returning user。",
    "room deep link 只延後 Welcome，不能把 onboarding 永久標記為完成。",
    "Next 與 Back 不寫 onboarding marker。",
    "Demo、Create、Skip 的完成 callback 在 App 與 Dialog 層都只執行一次。",
    "First-run session 不標記 current release seen，也不與 What's New 或 FeatureTour 疊加。",
    "storage write 失敗時，本 session 仍 resolved 且使用者選擇繼續執行。"
  ],
  "nonGoals": [
    "不自動建立 Firebase room 或複製東京範例。",
    "不把 Demo 放入 myTrips 或 Offline Trip Cache。",
    "不提供完整離線編輯或背景同步。",
    "不把裝置 member identity 當成授權。",
    "不修改 FeatureTour chapters 或自動標記 release seen。"
  ],
  "decisions": [
    { "id": "ADR-001", "summary": "Built-in Demo 使用本機資料，不寫 Firebase Database 或 Storage。", "status": "accepted" },
    { "id": "ADR-002", "summary": "Built-in Demo 不加入代表真實旅程參照的 myTrips。", "status": "accepted" },
    { "id": "ADR-004", "summary": "Offline Preview 是唯讀快照，不支援離線 mutation replay。", "status": "accepted" },
    { "id": "ADR-005", "summary": "Demo 與 first-run phases 不修改既有 FeatureTour chapters。", "status": "accepted" }
  ],
  "risks": [
    { "severity": "high", "description": "localStorage 訊號只能判斷裝置使用歷史，不能作為身分或授權證據。", "mitigation": "保持 onboarding eligibility 與 Firebase authorization 完全分離。" },
    { "severity": "medium", "description": "storage 完全不可用時安全 fallback 會把裝置視為 fresh，可能再次顯示 Welcome。", "mitigation": "App 以 firstRunResolved 在同一 session 防止重開，並將失敗視為非致命。" },
    { "severity": "medium", "description": "App.jsx 同時協調 release、Demo、Offline、Trip 與 modal，優先順序變更容易造成疊加回歸。", "mitigation": "維持 integration 與 E2E 排他性測試。" },
    { "severity": "low", "description": "真實行動裝置的虛擬鍵盤與 safe-area 行為仍可能不同於 Playwright Mobile Safari。", "mitigation": "保留實機 QA，不以模擬專案取代。" }
  ],
  "tests": [
    { "path": "src/features/onboarding/onboardingState.test.js", "type": "unit", "behaviorProtected": "marker failure safety、所有 eligibility 訊號、empty trips 與 deep-link eligibility。", "evidenceStatus": "passed" },
    { "path": "src/features/onboarding/FirstRunWelcomeDialog.test.jsx", "type": "component", "behaviorProtected": "四步內容、一次性 callback、focus trap、Escape、scroll lock、mobile layout 與無 storage access。", "evidenceStatus": "passed" },
    { "path": "src/App.firstRunWelcomeIntegration.test.jsx", "type": "integration", "behaviorProtected": "Welcome 優先順序、三種完成動作、Firebase/offline non-effects、release 恢復與 deep-link 延後。", "evidenceStatus": "passed" },
    { "path": "e2e/first-run-welcome.spec.ts", "type": "e2e", "behaviorProtected": "真實 browser flow、Emulator rooms 為空、localStorage marker、Mobile layout 與 deep-link 返回。", "evidenceStatus": "passed" }
  ],
  "evidence": [
    { "id": "E1", "claim": "onboarding marker 是 version 1 且 key 為 travel-app-seen-onboarding-v1。", "path": "src/features/onboarding/onboardingState.js", "symbol": "FIRST_RUN_ONBOARDING_VERSION / FIRST_RUN_ONBOARDING_SEEN_KEY", "lineStart": 1, "lineEnd": 5, "confidence": "verified" },